{
  "schema_version": "1.0",
  "task_id": "crypto_funding_basis:E001:20260921T140833Z",
  "project_id": "crypto_funding_basis",
  "repository": "williammolina489/crypto-funding-basis-bot",
  "experiment_id": "E001",
  "starting_sha": "87a40b91052e3c6f0800f55fe3987f27b27a795b",
  "ending_sha": "87a40b91052e3c6f0800f55fe3987f27b27a795b",
  "outcome": "BLOCKED",
  "summary": "Stage 1 remains blocked because the frozen BTCUSD production book still did not satisfy the executable non-empty bid/ask requirement.",
  "evidence": [
    {
      "type": "URL",
      "reference": "https://github.com/williammolina489/crypto-funding-basis-bot/actions/runs/35610149714",
      "summary": "GitHub Actions read-only live-validation run."
    },
    {
      "type": "LOG",
      "reference": "https://github.com/williammolina489/crypto-funding-basis-bot/actions/runs/35610149714#logs",
      "summary": "BTCUSD live book ack_id=7687002384765643386, best_bid=None, best_ask=None."
    }
  ],
  "checks": [
    {
      "name": "read_only_safety",
      "status": "PASS",
      "details": "authentication_used=False; orders_or_writes_performed=False"
    },
    {
      "name": "btcusd_executable_book",
      "status": "FAIL",
      "details": "live_symbol=BTCUSD; ack_id=7687002384765643386; bid_levels=0; ask_levels=0; best_bid_price=None; best_ask_price=None"
    }
  ],
  "methodology_changed": false,
  "protected_data_access": {
    "validation": false,
    "oos": false
  },
  "financial_action_taken": false,
  "human_action_required": true,
  "human_action_reason": "The finite Stage-1 revalidation protocol is exhausted. This was the final authorized Checkpoint B; no further automatic retries are permitted without a new explicit decision.",
  "recommended_next_action": "Record the final Stage-1 BLOCKED classification in the worker repository and stop automatic revalidation. Do not substitute instruments or continue retrying without a new explicit decision.",
  "pull_request": null,
  "completed_at": "2026-09-21T14:09:06.189142+00:00"
}
